{
  "spec_version": 1,
  "vocabulary": "capabilities",
  "description": "Fashion Cabinet's hyperobject.capabilities keys. The garment manifest schema types the block as `additionalProperties: {type: boolean}` — every key is legal and none is defined — and 516 cartridges have written 134 distinct ones, most of them once. This document is the missing enum, but assembled additively rather than imposed: every observed key is here, the near-duplicates canonicalise onto a spelling through `aliases`, the narrower claims hang off their broader key through `narrower_than` instead of collapsing into it, and the one pair that LOOKS like a duplicate and is not is recorded through `distinct_from`. A consumer can therefore validate against this vocabulary today without failing a single existing cartridge.",
  "captured": {
    "date": "2026-09-02",
    "sources": {
      "yantra4d": {
        "path": "docs/commons-catalog.json",
        "rev": "80892074",
        "cartridges": 500
      },
      "fashion-cabinet": {
        "path": "projects/*/project.json",
        "rev": "fdb88c5",
        "cartridges": 516
      }
    }
  },
  "review": {
    "state": "generated",
    "note": "Assembled from the capture below by an agent pass, 2026-09-02. The COUNTS are measurements and the CANONICALISATIONS are proposals: every alias asserts that two spellings make one claim, and every distinct_from asserts that two similar spellings do not. Those are rulings a maintainer should read before the vocabulary is used to rewrite anything."
  },
  "entries": [
    {
      "key": "adaptive",
      "repo": "fashion-cabinet",
      "role": "capability_flag",
      "status": "canonical",
      "term": "adaptive",
      "observed": {
        "cartridges": 2,
        "true": 2
      },
      "manifest_enum": false
    },
    {
      "key": "adjustable_fit",
      "repo": "fashion-cabinet",
      "role": "capability_flag",
      "status": "canonical",
      "gloss": "The garment's fit can be changed after it is made, by the wearer.",
      "observed": {
        "cartridges": 1,
        "true": 1
      },
      "manifest_enum": false
    },
    {
      "key": "adjustable_straps",
      "repo": "fashion-cabinet",
      "role": "capability_flag",
      "status": "canonical",
      "gloss": "The straps adjust in length through hardware.",
      "narrower_than": {
        "key": "adjustable_fit",
        "repo": "fashion-cabinet"
      },
      "observed": {
        "cartridges": 1,
        "true": 1
      },
      "manifest_enum": false
    },
    {
      "key": "am_fashion",
      "repo": "fashion-cabinet",
      "role": "capability_flag",
      "status": "canonical",
      "term": "am-fashion",
      "observed": {
        "cartridges": 21,
        "true": 21
      },
      "manifest_enum": false
    },
    {
      "key": "band_collar",
      "repo": "fashion-cabinet",
      "role": "capability_flag",
      "status": "canonical",
      "gloss": "A straight standing band at the neck, with no collar leaf.",
      "observed": {
        "cartridges": 1,
        "true": 1
      },
      "manifest_enum": false
    },
    {
      "key": "bias_cutting",
      "repo": "fashion-cabinet",
      "role": "capability_flag",
      "status": "canonical",
      "term": "bias-cutting",
      "observed": {
        "cartridges": 2,
        "true": 2
      },
      "manifest_enum": false
    },
    {
      "key": "bolt_unit",
      "repo": "fashion-cabinet",
      "role": "capability_flag",
      "status": "canonical",
      "gloss": "The draft's unit is the bolt of cloth as woven — the kimono tradition's tanmono — rather than the body.",
      "observed": {
        "cartridges": 1,
        "true": 1
      },
      "manifest_enum": false,
      "note": "A cloth-as-unit claim like `panel_width_native`; whether the two are one claim is a ruling nobody has made."
    },
    {
      "key": "boned",
      "repo": "fashion-cabinet",
      "role": "capability_flag",
      "status": "canonical",
      "term": "boned",
      "observed": {
        "cartridges": 4,
        "true": 4
      },
      "manifest_enum": false
    },
    {
      "key": "boning_channels",
      "repo": "fashion-cabinet",
      "role": "capability_flag",
      "status": "canonical",
      "gloss": "The garment carries sewn channels for bones, whether or not bones are supplied.",
      "narrower_than": {
        "key": "boned",
        "repo": "fashion-cabinet"
      },
      "observed": {
        "cartridges": 1,
        "true": 1
      },
      "manifest_enum": false
    },
    {
      "key": "boning_optional",
      "repo": "fashion-cabinet",
      "role": "capability_flag",
      "status": "canonical",
      "gloss": "The garment is drafted to work with or without bones, so the bones are a choice rather than the structure.",
      "observed": {
        "cartridges": 1,
        "true": 1
      },
      "manifest_enum": false
    },
    {
      "key": "bound_edges",
      "repo": "fashion-cabinet",
      "role": "capability_flag",
      "status": "canonical",
      "gloss": "Edges finished with a binding strip rather than a facing or a turn-up.",
      "observed": {
        "cartridges": 1,
        "true": 1
      },
      "manifest_enum": false
    },
    {
      "key": "bound_neckline",
      "repo": "fashion-cabinet",
      "role": "capability_flag",
      "status": "canonical",
      "term": "bound-neckline",
      "narrower_than": {
        "key": "bound_edges",
        "repo": "fashion-cabinet"
      },
      "observed": {
        "cartridges": 2,
        "true": 2
      },
      "manifest_enum": false
    },
    {
      "key": "breakaway_seam",
      "repo": "fashion-cabinet",
      "role": "capability_flag",
      "status": "canonical",
      "gloss": "A seam engineered to release under a deliberate pull.",
      "narrower_than": {
        "key": "quick_change",
        "repo": "fashion-cabinet"
      },
      "observed": {
        "cartridges": 1,
        "true": 1
      },
      "manifest_enum": false
    },
    {
      "key": "built_in_liner",
      "repo": "fashion-cabinet",
      "role": "capability_flag",
      "status": "canonical",
      "term": "built-in-liner",
      "observed": {
        "cartridges": 2,
        "true": 2
      },
      "manifest_enum": false
    },
    {
      "key": "busk_free",
      "repo": "fashion-cabinet",
      "role": "capability_flag",
      "status": "canonical",
      "gloss": "A corsetry garment with no front busk: it closes another way, or does not open at the front at all.",
      "observed": {
        "cartridges": 1,
        "true": 1
      },
      "manifest_enum": false
    },
    {
      "key": "button_closure",
      "repo": "fashion-cabinet",
      "role": "capability_flag",
      "status": "canonical",
      "term": "button-closure",
      "observed": {
        "cartridges": 3,
        "true": 3
      },
      "manifest_enum": false
    },
    {
      "key": "channel_routing",
      "repo": "fashion-cabinet",
      "role": "capability_flag",
      "status": "canonical",
      "term": "channel-routing",
      "observed": {
        "cartridges": 2,
        "true": 2
      },
      "manifest_enum": false
    },
    {
      "key": "closed_rectangle",
      "repo": "fashion-cabinet",
      "role": "capability_flag",
      "status": "canonical",
      "gloss": "A rectangle closed on itself, worn over the head — the poncho construction.",
      "observed": {
        "cartridges": 1,
        "true": 1
      },
      "manifest_enum": false
    },
    {
      "key": "closure_free",
      "repo": "fashion-cabinet",
      "role": "capability_flag",
      "status": "canonical",
      "term": "closure-free",
      "observed": {
        "cartridges": 10,
        "true": 9
      },
      "manifest_enum": false
    },
    {
      "key": "co_create",
      "repo": "fashion-cabinet",
      "role": "capability_flag",
      "status": "canonical",
      "gloss": "The cartridge is offered for co-creation with the tradition or community it comes from.",
      "observed": {
        "cartridges": 1,
        "true": 1
      },
      "manifest_enum": false
    },
    {
      "key": "compression_support",
      "repo": "fashion-cabinet",
      "role": "capability_flag",
      "status": "canonical",
      "term": "compression-support",
      "observed": {
        "cartridges": 7,
        "true": 7
      },
      "manifest_enum": false
    },
    {
      "key": "compression_zoned",
      "repo": "fashion-cabinet",
      "role": "capability_flag",
      "status": "canonical",
      "gloss": "Different panels compress by different amounts.",
      "narrower_than": {
        "key": "compression_support",
        "repo": "fashion-cabinet"
      },
      "observed": {
        "cartridges": 1,
        "true": 1
      },
      "manifest_enum": false
    },
    {
      "key": "contrast_colorblocking",
      "repo": "fashion-cabinet",
      "role": "capability_flag",
      "status": "canonical",
      "gloss": "Panels are cut in contrasting colours as the design.",
      "observed": {
        "cartridges": 1,
        "true": 1
      },
      "manifest_enum": false
    },
    {
      "key": "contrast_trim",
      "repo": "fashion-cabinet",
      "role": "capability_flag",
      "status": "canonical",
      "gloss": "Trim in a contrasting colour along the garment's edges.",
      "observed": {
        "cartridges": 1,
        "true": 1
      },
      "manifest_enum": false
    },
    {
      "key": "curved_collar",
      "repo": "fashion-cabinet",
      "role": "capability_flag",
      "status": "canonical",
      "gloss": "A collar drafted on a curve rather than as a straight band.",
      "observed": {
        "cartridges": 1,
        "true": 1
      },
      "manifest_enum": false
    },
    {
      "key": "cut_in_one_sleeve",
      "repo": "fashion-cabinet",
      "role": "capability_flag",
      "status": "canonical",